"EMAIL","SENT_DATETIME","SENDER_NAME","SENDER_ADDRESS","EMAIL_TITLE","CONTENTS","CREATE_USER_NO","CREATE_DATE"
"akiko_hirose13@yahoo.co.jp","2020-02-04 16:18:08","サクラビアクリニック","unei@eparkdock.com","健診予約の件","廣瀬様\
去年も健康診断をご利用頂き、再度今年もご予約頂き\
誠にありがとうございます。\
\
電話にてご連絡させて頂きましたが、ご不在の為\
メールにてご連絡させて頂きます。\
\
健康診断の日程はご希望の日でご予約ができました。\
\
2/13【木】9：30にてご予約を確定させて頂きます。\
\
去年と同じく注意事項と質問票を本日、ご自宅に御郵送させて頂きます。\
\
当日心よりお待ちしております。\
ご予約ありがとうございました。　　受付担当　栗栖","B39724","2020-02-04 16:18:08"
"natumisadayuki@gmail.com","2020-03-12 14:51:47","サクラビアクリニック　","unei@eparkdock.com","健康診断の日程のご予約","\
健康診断のご予約頂き、ありがとうございます。\
電話がつながらなかったのでメールにてご連絡させて頂きます。\
\
希望日の3月27日は9時15分が空いておりましたので\
この時間にてご予約させて頂きます。\
ご予約時間の5分前のご来院をお願い致します。\
\
健康診断の注意事項と問診票を本日ご登録の住所に\
ご郵送させて頂きます。\
当日は問診票のみお持ち下さい。\
\
お会計は現金会計になりますので\
現金のご用意をお願い致します。\
\
※健康診断の結果を記入する指定用紙がある方は\
必ず電話にてご連絡頂きますようお願い致します。\
\
何かわからないことがありましたら、電話にてご連絡下さい。\
医療法人社団聖桜会　サクラビアクリニック\
","B39724","2020-03-12 14:51:47"
